[
 {
  "region_id": "JAH-REGION-000001",
  "name": "the Signature ecosystem",
  "papers": [
   "JAH-PAPER-000001"
  ],
  "fictionality_status": "FICTIONAL_GENERATED",
  "note": "News desk beat, not a place: this paper covers one beat of the Signature website network (catalogs, AI, builders, culture, markets) plus the flagship all-network edition."
 },
 {
  "region_id": "JAH-REGION-000002",
  "name": "Catalogs & Records",
  "papers": [
   "JAH-PAPER-000002"
  ],
  "fictionality_status": "FICTIONAL_GENERATED",
  "note": "News desk beat, not a place: this paper covers one beat of the Signature website network (catalogs, AI, builders, culture, markets) plus the flagship all-network edition."
 },
 {
  "region_id": "JAH-REGION-000003",
  "name": "AI & Systems",
  "papers": [
   "JAH-PAPER-000003"
  ],
  "fictionality_status": "FICTIONAL_GENERATED",
  "note": "News desk beat, not a place: this paper covers one beat of the Signature website network (catalogs, AI, builders, culture, markets) plus the flagship all-network edition."
 },
 {
  "region_id": "JAH-REGION-000004",
  "name": "Builders & Labs",
  "papers": [
   "JAH-PAPER-000004"
  ],
  "fictionality_status": "FICTIONAL_GENERATED",
  "note": "News desk beat, not a place: this paper covers one beat of the Signature website network (catalogs, AI, builders, culture, markets) plus the flagship all-network edition."
 },
 {
  "region_id": "JAH-REGION-000005",
  "name": "Library & Culture",
  "papers": [
   "JAH-PAPER-000005"
  ],
  "fictionality_status": "FICTIONAL_GENERATED",
  "note": "News desk beat, not a place: this paper covers one beat of the Signature website network (catalogs, AI, builders, culture, markets) plus the flagship all-network edition."
 },
 {
  "region_id": "JAH-REGION-000006",
  "name": "Markets",
  "papers": [
   "JAH-PAPER-000006"
  ],
  "fictionality_status": "FICTIONAL_GENERATED",
  "note": "News desk beat, not a place: this paper covers one beat of the Signature website network (catalogs, AI, builders, culture, markets) plus the flagship all-network edition."
 }
]